{
  "$schema": "../../schemas/governance/ui-design-tokens.schema.json",
  "version": "1.0",
  "theme": "meridian-dark",
  "policies": {
    "dense_content": "opaque",
    "focus_geometry": "rectangular-edge-contrast-shape",
    "decorative_ring": false,
    "scene_tinted_chrome": false,
    "blur": "floating-overlays-and-title-chrome-with-opaque-fallback"
  },
  "records": [
    {"id":"token.color.background","category":"color","value":"#090b0b","unit":"hex-srgb","purpose":"Application background"},
    {"id":"token.color.surface","category":"color","value":"#121515","unit":"hex-srgb","purpose":"Opaque panel surface"},
    {"id":"token.color.border","category":"color","value":"#292d2c","unit":"hex-srgb","purpose":"Borders and separators"},
    {"id":"token.color.text-primary","category":"color","value":"#e3e1d8","unit":"hex-srgb","purpose":"Primary readable text"},
    {"id":"token.color.text-secondary","category":"color","value":"#929790","unit":"hex-srgb","purpose":"Secondary text"},
    {"id":"token.color.muted","category":"color","value":"#686e68","unit":"hex-srgb","purpose":"Muted and disabled metadata"},
    {"id":"token.color.destructive","category":"color","value":"#a73732","unit":"hex-srgb","purpose":"Destructive action"},
    {"id":"token.color.destructive-hover","category":"color","value":"#c04b44","unit":"hex-srgb","purpose":"Hovered destructive action"},
    {"id":"token.color.positive","category":"color","value":"#8d8961","unit":"hex-srgb","purpose":"Positive state"},
    {"id":"token.color.warning","category":"color","value":"#c0964e","unit":"hex-srgb","purpose":"Warning and emphasis"},
    {"id":"token.font.interface","category":"font","value":"Mona Sans","unit":"font-family","purpose":"Interface text"},
    {"id":"token.font.display","category":"font","value":"Hubot Sans","unit":"font-family","purpose":"Restrained display headings"},
    {"id":"token.font.mono","category":"font","value":"JetBrains Mono","unit":"font-family","purpose":"Code and technical data"},
    {"id":"token.spacing.base","category":"spacing","value":4,"unit":"logical-px","purpose":"Base spacing unit"},
    {"id":"token.spacing.dock-gutter","category":"spacing","value":8,"unit":"logical-px","purpose":"Dock gutter"},
    {"id":"token.border.standard","category":"border","value":1,"unit":"logical-px","purpose":"Standard border"},
    {"id":"token.radius.compact","category":"radius","value":4,"unit":"logical-px","purpose":"Compact controls"},
    {"id":"token.radius.control","category":"radius","value":6,"unit":"logical-px","purpose":"Fields and cards"},
    {"id":"token.radius.panel","category":"radius","value":10,"unit":"logical-px","purpose":"Panels and menus"},
    {"id":"token.radius.floating","category":"radius","value":14,"unit":"logical-px","purpose":"Large floating surfaces"},
    {"id":"token.size.application-row","category":"size","value":44,"unit":"logical-px","purpose":"Application row height"},
    {"id":"token.size.workspace-row","category":"size","value":36,"unit":"logical-px","purpose":"Workspace row height"},
    {"id":"token.size.status-row","category":"size","value":24,"unit":"logical-px","purpose":"Status row height"},
    {"id":"token.size.activity-rail-collapsed","category":"size","value":44,"unit":"logical-px","purpose":"Collapsed activity rail"},
    {"id":"token.size.activity-rail-expanded","category":"size","value":160,"unit":"logical-px","purpose":"Expanded activity rail"},
    {"id":"token.size.browser","category":"size","value":264,"unit":"logical-px","purpose":"Default browser width"},
    {"id":"token.size.world-inspector","category":"size","value":344,"unit":"logical-px","purpose":"Default World Inspector width"},
    {"id":"token.size.bottom-shelf-peek","category":"size","value":32,"unit":"logical-px","purpose":"Collapsed bottom shelf"},
    {"id":"token.size.bottom-shelf-expanded","category":"size","value":240,"unit":"logical-px","purpose":"Initial expanded bottom shelf"},
    {"id":"token.motion.state-min","category":"motion","value":100,"unit":"milliseconds","purpose":"Minimum small state transition"},
    {"id":"token.motion.state-max","category":"motion","value":160,"unit":"milliseconds","purpose":"Maximum small state transition"},
    {"id":"token.effect.backdrop-policy","category":"effect","value":"bounded-floating-only","unit":"policy","purpose":"Backdrop effect policy"}
  ]
}
